tez_no,thesis_key,encrypted_no,author,year,title,title_en,title_tr,university,university_raw,language,thesis_type,subject,advisor,institute,department,keywords,abstract,pdf_available
999521,iRBvNKEVoW2t7xXYqLrfFw,2eSdjleQC9EB4u0M0hhDPg,BUKET TÜMBUL,2026,Comparatıve analysıs of spatıal experıence ın physıcal and vırtual envıronments: The case of anadolu hısarı / Fiziksel ve sanal ortamlarda mekansal deneyimin karşılaştırmalı analizi: Anadolu hisarı örneği,Comparatıve analysıs of spatıal experıence ın physıcal and vırtual envıronments: The case of anadolu hısarı,Fiziksel ve sanal ortamlarda mekansal deneyimin karşılaştırmalı analizi: Anadolu hisarı örneği,Istanbul Technical University,İSTANBUL TEKNİK ÜNİVERSİTESİ,İngilizce,Yüksek Lisans,Mimarlık = Architecture,DOÇ. DR. AHMET GÜN,LİSANSÜSTÜ EĞİTİM ENSTİTÜSÜ,MİMARLIK ANABİLİM DALI,,"Mekân deneyimi, bireyin içinde bulunduğu çevreyle kurduğu duyusal, bilişsel ve fiziksel etkileşimlerin bütünüdür. İnsan zihni, mekânı yalnızca görsel girdiler üzerinden değil; dokunma, işitme, koku alma ve bedensel hareket gibi çok duyulu kanalların eş zamanlı işleyişiyle algılar, anlamlandırır ve hafızasında yapılandırır. Çevre psikolojisi literatürü, birey ile çevre arasındaki bu etkileşimin mekânsal algı ve davranışlar üzerindeki belirleyici rolünü vurgulamaktadır. Fiziksel mekan deneyimi, kullanıcının bedeniyle doğrudan ortamın içinde bulunduğu, dokunma, işitme, koku alma ve hareket etme gibi çok duyulu kanalların eş zamanlı çalıştığı somut bir süreçtir. Fiziksel dünyada yüzeylerin dokusu, havanın sıcaklığı, ortamın kokusu ve akustik özellikler, mekanın gerçekliğini oluşturan temel bileşenlerdir.
Sanal Gerçeklik ise, bilgisayar teknolojileri kullanılarak oluşturulan, kullanıcıyı fiziksel dünyadan soyutlayarak yapay bir ortamın içine dahil etmeyi amaçlayan simülasyon teknolojisidir. VR teknolojileri, sundukları üç boyutlu görsellik ve mevcudiyet hissi sayesinde kullanıcılara farklı mekanları deneyimleme imkanı sunar. Sanal ortamda mekan deneyimi, ağırlıklı olarak görsel ve işitsel uyaranların taklit edilmesi prensibine dayanır. Teknolojik gelişmeler önemli ölçüde ilerlese de sanal ortamların, fiziksel dünyanın sunduğu deneyimi ne ölçüde karşılayabildiği henüz netlik kazanmamış bir konudur. Bu teknolojik sınırlar dahilinde, sanal deneyimin fiziksel mekan algısını ne düzeyde temsil edebildiği ve kullanıcının 'orada olma' hissini nasıl şekillendirdiği, araştırılması gereken önemli bir alan oluşturmaktadır. Bununla birlikte, VR ile oluşturulan dijital mekânlar geleneksel fiziksel sınırların ötesine geçerek kullanıcılara benzersiz, erişilebilir ve çok duyulu deneyimler sunma potansiyeline sahiptir.
Literatürdeki çalışmaları incelemek ve eksikleri tespit etmek için kaynaklar, odak noktalarına ve yöntemlerine göre sınıflandırılmıştır. İncelemeler sonucunda, sanal gerçeklik araştırmalarının genellikle teknik performans iyileştirmeleri, sağlık alanındaki rehabilitasyon uygulamaları ve mimari eğitim araçları olmak üzere belirli başlıklar altında toplandığı görülmüştür. Mevcut çalışmalar incelendiğinde ortaya çıkan ilk kesit, araştırmaların ağırlıklı olarak kontrollü laboratuvar ortamlarında performans odaklı değerlendirmelere dayanmasıdır. Ancak, insanların kendi istekleriyle etkileşime girdikleri ve sosyal amaçlarla deneyimledikleri mekânlarda varlık hissi, mekân duygusu ve keşif deneyiminin nasıl şekillendiğini ele alan çalışmalar oldukça sınırlıdır. Ortaya çıkan ikinci kesit ise mekansal tipoloji ile ilgilidir; çalışmaların büyük çoğunluğu kapalı ortamlara odaklanırken, iç ve dış mekan özelliklerini bir arada barındıran ve duyusal çeşitlilik sunan yarı açık mekânların deneyimi neredeyse hiç ele alınmamıştır. Literatürdeki bu çok boyutlu eksikliği ele almak ve bu çalışma alanına yönelmek amacıyla, sosyalleşme amaçlı kullanılan yarı açık bir mekân örneği olarak Anadolu Hisarı Müzesi çalışma sahası olarak seçilmiştir. Seçilen alanın bir kültürel miras olması, mekanın sadece bir kapsayıcı olmasını değil, deneyimin asıl nesnesi olarak ele alınmasına olanak tanımıştır.
Bu doğrultuda, fiziksel ve sanal ortamdaki mekânsal deneyimin algısal ve duyusal farklılıklarını derinlemesine anlamaya yönelik bir çalışma yapılmasına karar verilmiştir. Çok boyutlu bir tutum çerçevesi benimseyen araştırma kurgusu, bütüncül ve yapısal bir karşılaştırma yapabilmek adına mekânsal deneyimi bilişsel, duygusal ve davranışsal bileşenlerine ayırarak incelemektedir. Araştırmada, hem sayısal veriler hem de sözlü çıktılar toplayabilmek amacıyla karma yöntemli bir grup deneyi yürütülmüştür. Mekânsal deneyimi karşılaştırmalı olarak analiz etmek amacıyla katılımcılar, kontrol grubunu oluşturan fiziksel deneyim grubu (n = 9) ve deney grubunu temsil eden Sanal deneyim grubu (n = 8) olmak üzere iki ana kategoriye ayrılmıştır. Katılımcıların tamamı birinci sınıf mimarlık öğrencilerinden seçilmiştir. Fiziksel grup, Anadolu Hisarı'nı yerinde, mevcut atmosferik koşullar ve duyusal uyaranlar eşliğinde sırayla deneyimlemişlerdir. Sanal grup, mekânın Blender yazılımı kullanılarak birebir ölçülerde modellenmesi ve Unity oyun motoruna aktarılmasıyla hazırlanan ortamı Meta Quest 3 başlığı aracılığıyla deneyimlemiştir. Deneyim süreci boyunca, fiziksel deneyim grubundaki katılımcıların mekânla etkileşimleri iki farklı açıdan video kayıtlarıyla belgelenmiş; sanal deneyim grubunda ise katılımcıların deneyimleri ekran kayıtları aracılığıyla kaydedilmiştir. Deneyim sürecinin ardından her iki gruptaki katılımcılarla yarı yapılandırılmış görüşmeler gerçekleştirilmiş ve mekânın bilişsel temsillerini ortaya koymak amacıyla katılımcılardan bilişsel harita çizmeleri istenmiştir. Ayrıca, yalnızca sanal deneyim grubundaki katılımcılardan, fizyolojik etkileri değerlendirmek amacıyla simülatör hastalığı anketi (SSQ) ve öznel varlık hissini ölçmek amacıyla igroup varlık anketi (IPQ)'ni, deneyim sonrasında Google Form aracılığıyla doldurmaları istenmiştir.
Katılımcılarla deneyim sonrasında gerçekleştirilen yarı yapılandırılmış görüşmelerin dökümleri, yapay zeka destekli NLP teknikleri kullanılarak duygu analizi yapılmıştır. Elde edilen veriler, nitel ve nicel yöntemlerin bir arada kullanıldığı karma bir yaklaşımla değerlendirilmiştir. Analiz sonucunda mekansal deneyime dair yedi temel kategori belirlenmiş ve bu kategoriler bağımsız örneklemler t-testi ile karşılaştırılmıştır. Nicel analizler, iki grubun genel duygu düzeyleri arasında istatistiksel olarak anlamlı bir fark olmadığını; her iki ortamın da katılımcılar tarafından genel anlamda olumlu değerlendirildiğini göstermiştir. Ancak bu olumlu algının kökenini oluşturan deneyimsel bileşenlerin birbirinden belirgin şekilde ayrıştığı tespit edilmiştir. Fiziksel grup katılımcıları; taş duvarların dokusu, denizin kokusu ve rüzgarın teması gibi çok duyulu etkileşimler sayesinde mekanın tarihi atmosferi ve mimari kimliğiyle derin ve somut bir bağ kurmuşlardır. Buna karşın sanal deneyim; ağırlıklı olarak görsel temsilin gücü, mevcudiyet hissi, algı, teknolojik yenilik ve oyun gibi hissi üzerinden tanımlanmıştır. Dikkat çekici bir diğer bulgu ise mekânsal yön bulma ve dolaşım süreçleri incelendiğinde, iki grup arasında dikkat çekici bir algısal farklılık gözlemlenmiştir. Fiziksel ortamdaki dolaşım rotasının belirsizliği katılımcılarda kaygı ve huzursuzluk yaratırken, sanal ortamda aynı belirsizlik durumu bir özgürlük alanı ve keşif hissi olarak algılanmıştır. Buna rağmen, sanal deneyimin mekânsal düzeni kavrama ve zihinsel harita oluşturma konusunda fiziksel deneyime yakın bir bilişsel altyapı sağladığı görülmüştür. Bunun yanı sıra, 'manzara' unsuru her iki grup için de en güçlü ve ortak pozitif deneyim kaynağı olarak öne çıkmıştır. Bu durum, sanal ortamın görsel gerçekliği sağlamada başarılı olduğunu, ancak fiziksel mekanın sunduğu bütüncül 'orada olma' hissini yaratmada boşluklar barındırdığını destekler nitelikte olduğunu göstermektedir.
Başka bir karşılaştırma ise, video analizi yöntemi kullanılarak katılımcıların davranış biçimleri ve süreleri üzerinden yapılmıştır. Fiziksel ve sanal ortamlardaki farklı hareket mekanikleri nedeniyle toplam deneyim süresi doğrudan bir karşılaştırma ölçütü olarak ele alınmamış, bunun yerine katılımcıların mekân içindeki farklı alanlara ayırdıkları süreler ve davranış örüntüleri incelenmiştir. Her iki ortamda da katılımcıların en fazla zamanı manzarayla doğrudan ilişki kurulan teras alanında geçirdikleri görülmüştür; fiziksel deneyimde katılımcılar terasta ortalama 125.11 saniye, zemin katta ise 95.33 saniye geçirirken, sanal deneyimde bu süreler teras için 74.25 saniye, zemin kat için 44.75 saniye olarak ölçülmüştür. Bu paralel dağılım, dış atmosferle kurulan görsel ilişkinin mekânsal deneyimde önemli bir bileşen olduğunu ortaya koymaktadır. Fiziksel deneyimde kullanıcıların yüzey dokuları, yapısal elemanlar ve tarihsel izlere yönelik duraksama ve odaklanma davranışları daha sık gözlemlenmiştir. Buna karşılık, sanal katılımcıların kafa hareketlerinin daha hızlı ve odaklanma sürelerinin daha kısa olduğu, mekânı bir duraksama olmaksızın hızlıca kat ettikleri gözlemlenmiştir. Ayrıca, sanal ortamda gözlemlenen doğrusal hareket örüntüsü, katılımcıların mekâna giriş anında algıladıkları ilk görsel odağa yönelme eğilimi gösterdiklerini ortaya koymaktadır. Katılımcılar, girişte gördükleri ilk mekânsal eleman veya açıklık doğrultusunda hareket etmiş ve dolaşımlarını bu yönelim üzerinden sürdürmüşlerdir. Bu durum, sanal ortamın 360 derece görüş ve serbest dolaşım olanaklarına rağmen, algının daralmasına ve mekânsal deneyimin bir doğrultu üzerinden şekillenmesine neden olduğu düşünülmektedir.
Bunun yanı sıra, katılımcıların çizdiği bilişsel haritalar üzerinden yapılan karşılaştırmada, fiziksel deneyimin mekâna ilişkin zihinsel temsillerin ayrıntı düzeyi ve doğruluğu üzerinde belirleyici bir etkisi olduğu görülmüştür. Fiziksel ortamı deneyimleyen katılımcıların çizimleri; ölçek ilişkileri, malzeme dokuları ve mekânsal hiyerarşi açısından daha tutarlı ve detaylıyken, sanal deneyim grubunun haritaları çoğunlukla şematik ve indirgenmiş temsillerle sınırlı kalmıştır. Buna karşın, her iki grubun da mekânın genel organizasyonunu ve temel dolaşım ilişkilerini benzer biçimde kurguladığı, yani mekânsal ilişkileri kurma düzeyinde anlamlı bir ayrışma oluşmadığı tespit edilmiştir. Bu bulgular, sanal deneyimin mekânsal bütünlüğü kavrama açısından yeterli bir çerçeve sunduğunu, ancak duyusal ve maddesel niteliklerin zihinsel temsillere aktarımında fiziksel deneyimin daha güçlü olduğunu ortaya koymaktadır.
Sanal grubun bilişsel deneyiminde, varlık hissi ile algılanan gerçekçilik arasındaki ilişki belirleyici unsurlardan biri olarak öne çıkmaktadır. IPQ (Igroup Presence Questionnaire (Igrup Varlık Anketi)) verileri incelendiğinde, katılımcıların sanal ortamda %68,7 oranında güçlü bir 'orada olma hissi' geliştirdikleri görülmüştür. Ancak bu yüksek varlık hissine karşın, sanal dünyanın fiziksel dünya ile kıyaslandığı 'gerçekçilik' puanı %18,7 seviyesinde kalmıştır. Bu istatistiksel fark, katılımcıların sanal ortamı içinde hareket edilebilir 'geçerli bir mekân' olarak benimsediklerini, ancak onu fiziksel gerçekliğin birebir bir yansıması olarak algılamadıklarını göstermektedir.
SSQ (Simulator Sickness Questionnaire (Simülatör Hastalığı Anketi)) verileri doğrultusunda değerlendirildiğinde, sanal grubun deneyim kalitesini etkileyen faktörlerden birinin fizyolojik konfor düzeyi olduğu görülmektedir. Buna göre, sanal katılımcıların yaşadığı rahatsızlıkların görsel yorgunluktan ziyade %53,3 oranında mide bulantısı ve genel bedensel rahatsızlık üzerinde yoğunlaştığı tespit edilmiştir. Ayrıca, katılımcıların geçmiş VR deneyimleri ile konfor düzeyleri arasında anlamlı bir ilişki bulunmaktadır. Daha önce VR deneyimi olmayan katılımcıların toplam rahatsızlık puanı ortalaması 25,67 iken, deneyimli kullanıcıların ortalaması 11,60 olarak ölçülmüştür. Bu sayısal fark, deneyimli kullanıcıların sanal ortama karşı bir alışkanlık kazandığını, deneyimsiz kullanıcıların ise teknolojik arayüzün getirdiği fizyolojik yük nedeniyle mekâna odaklanmakta zorlandığını göstermektedir.
Bu çalışma, fiziksel ve sanal ortamlarda gerçekleşen mekânsal deneyimin farklı boyutlarda nasıl ayrıştığını ortaya koymaktadır. Nicel ve nitel analizler sonucunda, çoğu değişken açısından istatistiksel olarak anlamlı farklılıklar tespit edilmemiştir. Nitel bulgular, sanal mekân deneyiminin duygusal ve duyusal düzeyde fiziksel mekân deneyiminin yerini tam olarak alamadığını göstermektedir. Sanal mekân deneyimi, bilişsel süreçler ve mekânsal öğrenme bağlamında belirli ölçüde işlevsel bir araç olarak değerlendirilebileceğini göstermektedir.
Bu çalışmanın sınırlı sayıda katılımcı ile yürütülmüş olması ve katılımcı profilinin belirli bir grupla sınırlandırılmasının deney sonuçlarını etkileyebileceği unutulmamalıdır. Ayrıca, deney sürecindeki teknik faktörler, sonuçların değerlendirilmesinde göz önünde bulundurulmalıdır. Gelecekte yapılacak çalışmaların, daha geniş ve çeşitlendirilmiş katılımcı gruplarını kapsayacak şekilde kurgulanması; bulguların evrensel geçerliliğini artıracak ve literatüre daha kapsamlı, genellenebilir veriler sunulmasına katkı sağlayacağı düşünülmektedir.",True
999354,ZFI5kaeqTvTXxDwWU6_RaA,ohgave09qwhzrsdTeLMccg,EMRE RASIM,2026,LLC rezonans çeviricilerinin üretim tabanlı enuygunlaştırılmış tasarımına katkılar / Contributions to the manufacturing based optimizeddesign of LLC resonant converters,LLC rezonans çeviricilerinin üretim tabanlı enuygunlaştırılmış tasarımına katkılar,Contributions to the manufacturing based optimizeddesign of LLC resonant converters,Istanbul Technical University,İSTANBUL TEKNİK ÜNİVERSİTESİ,Türkçe,Yüksek Lisans,Elektrik ve Elektronik Mühendisliği = Electrical and Electronics Engineering,DOÇ. DR. DERYA AHMET KOCABAŞ,LİSANSÜSTÜ EĞİTİM ENSTİTÜSÜ,ELEKTRİK MÜHENDİSLİĞİ ANABİLİM DALI,Anahtarlamalı güç kaynağı = Switched mode power supply ; Güç elektroniği = Power electronics,"Global energy consumption rises annually, and the recent surge in artificial
intelligence has significantly shifted the focus of energy demand toward server
systems and data centers. Ensuring the sustainability of these infrastructures is now a
primary agenda in modern power electronics. To manage this demand efficiently, the
European Union implemented Regulation (EU) 2019/424. This mandate has
transformed the requirement for server power supplies to achieve efficiency levels
exceeding 96% from an optional feature into a strict legal obligation.
To meet these strict standards, the industry relies on resonant topologies capable of
soft switching, such as the LLC converter. However, the success of a power supply
design goes beyond merely hitting efficiency targets on a theoretical level. The true
measure of an industrial product lies in its ability to ensure that the entire output of a
production line operates with consistent stability, despite the inevitable material
variations found in manufacturing. Therefore, the fundamental goal of the design
process is not just to achieve superior efficiency but to create a consistent production
output that remains robust against tolerances under real-world conditions.
Standard optimization studies in the existing literature generally focus on identifying
a single best design point based on ideal component values. However, this approach
often fails to align with industrial realities. The parameters that dictate the operating
characteristics of the converter, such as resonant inductance, magnetizing inductance,
and resonant capacitance, form a highly sensitive impedance network that is tightly
interlinked. Deviations in the nominal values of these parameters can shift the gain
curve to an unpredictable operating point.
This unpredictability becomes a critical failure point because traditional optimization
methods typically treat these parameters as static. In real world mass production,
however, inductors and transformers are frequently used within a 20 percent tolerance
band, and capacitors within a 10 percent tolerance band. Designs that appear perfect
on paper pose a severe risk when transferred to the production environment due to the
various combinations of these component variations. These tolerance deviations can
shift the circuit's operating point from the intended zero voltage switching region to
the undesirable zero current switching region, causing the system to fail directly.
Therefore, treating manufacturing tolerances as a fundamental constraint from the very
beginning of the design process is vital for ensuring industrial reliability.
This thesis discusses the design of a half bridge LLC resonant converter intended for
the server and telecommunication markets, where power density and efficiency are
critical performance criteria. In the initial stages of the study, the fundamental
harmonic approximation was used to define the basic operating principle of the circuit
and to derive the gain equations. However, to obtain the power loss characteristics of
the components more precisely as a function of operating frequency during the design
process, an advanced frequency based loss model was introduced in addition to this
approximation. This aims to ensure the presimulation behavior of the designed circuit
reflects real world behavior.
In this modeling process, discrete material libraries compliant with industrial standards
were used, particularly for magnetic components like transformers and inductors,
which are decisive for total efficiency. While core losses were calculated using the
Steinmetz equation, which accounts for variations in magnetic flux density, the skin
and proximity effects created by high frequency currents on winding conductors were
incorporated into the analysis using the Dowell equation. By combining these
methods, a detailed analytical model was established that is capable of demonstrating
how the loss curves of the circuit vary across the frequency axis.
In the fourth section of the thesis, a novel method is presented regarding design
robustness and analysis efficiency. The concept of Safe Operating Area, typically used
in the literature for semiconductor switches, has been adapted for LLC resonant tank
dynamics through a novel approach in this study. This new approach begins with the
derivation of the ideal safe operating area based on nominal values, prior to any
tolerance analysis. In this initial verification stage, the design is subjected to four
sequential elimination criteria. First, the gain curve is mathematically scanned to check
for gain root existence; ensuring the converter can attain the required peak gain under
full load and sufficiently reduce gain under light load. Subsequently, the remaining
designs are tested to ensure the input impedance remains in the inductive region to
avoid capacitive mode failure. Finally, it is verified whether the stored magnetizing
energy is sufficient to discharge parasitic capacitances and if the required dead time
falls within feasible limits to maintain zero voltage switching.
Designs that pass the ideal boundary checks are subjected to the Eight Corner Test a
novel approach proposed to handle manufacturing uncertainties. The fundamental
basis of this test is the predictable and monotonic behavior of the LLC gain curve
specifically within the operational region utilized by designers. Based on this
characteristic, it is premised that worst case scenarios occur at the boundaries of the
parameter space. The validity of this premise has been verified within the study using
both Monte Carlo analysis and comprehensive Tolerance Space Surface Scanning
methods. The findings indicate that the extreme vertex points of the rectangular prism,
representing the tolerance limits of resonant components (Lr, Lm, 𝐶r), are the most
critical regions for system stability rather than the internal points.
In the analysis process, four distinct error scenarios are defined to simulate real world
production conditions, which are Prototype Level, Standard Level, Industrial Level,
and Wide Industrial Level. The proposed method filters designs by scanning the eight
extreme vertices of the tolerance prism corresponding to the selected scenario. As a
result of these analyses, the distinction between the Ideal 𝐿୬-Q Operating Area, valid
at nominal values, and the Tolerant 𝐿୬-Q Operating Area, which remains after
deducting the uncertainties caused by manufacturing tolerances, has been clearly
demonstrated. Consequently, a reliable design set is obtained that is capable of
maintaining ZVS capability not only under ideal laboratory conditions but also under
tolerance deviations on the mass production line.
In the fifth section of the thesis, the theoretical framework and safe operating
boundaries established in the previous sections are integrated into a multi variable
optimization process. The physical design of LLC resonant converters requires
selecting the most suitable combination of numerous discrete variables, such as
transformer core geometry, wire cross-section, number of turns, and air gap length.
The fact that these variables are not continuous functions and take specific catalog
values based on industrial standards complicates the solution space. In such a vast and
nonlinear parameter space, testing all possible hardware combinations one by one
using a brute force method extends the design time to an unacceptable level.
To solve this complex problem, the Particle Swarm Optimization (PSO) algorithm, a
metaheuristic method based on swarm intelligence, was employed in this study.
However, the PSO implementation in this work differs from standard approaches by
incorporating a unique in loop verification structure. Each candidate parameter set
(Lr, Lm, Cr) generated by the algorithm is primarily subjected to the Eight Corner Test
filter defined in Section 4. If the determined values carry a risk of ZVS loss under
manufacturing tolerances, the candidate solution is directly eliminated without
entering the computationally intensive physical inductor and transformer design
stages. Thanks to this strategic early elimination mechanism, significant time savings
are achieved by avoiding magnetic component calculations for invalid designs.
Consequently, the optimization process converges within minutes to a design that
meets efficiency and volume targets while ensuring maximum reliability on the
production line.
To demonstrate the validity of the proposed tolerance-based optimization
methodology, an LLC resonant converter with 400V input, 48V output, and 480W
power, compliant with data center standards, was designed. The performance of the
resulting design was verified through a two-stage process. In the first stage, the
magnetic components, which are the most critical elements of the circuit, were
analyzed using Ansys Electronics Desktop software. These Finite Element Method
based analyses visualized the magnetic flux distribution and proved that the designed
cores do not approach saturation limits even under worst case scenarios.
In the second stage, time-domain simulations conducted in LTspice showed that the
design maintains its zero voltage switching capability not only at nominal values but
also under the most critical tolerance scenarios identified by the Eight Corner Test.
In conclusion, with this thesis work; a design method that considers component
production tolerances under efficiency and volume constraints has been developed.
The validity of the proposed method has been verified in a simulation environment.
This study was supported by the Istanbul Technical University Scientific Research
Projects Coordination Unit (BAP) under the project number MYL-2024-46178.",True
