tez_no,thesis_key,encrypted_no,author,year,title,title_en,title_tr,university,university_raw,language,thesis_type,subject,advisor,institute,department,keywords,abstract,pdf_available
997825,rW-nlttuSJT6luPDe-k-2A,mwJlCUwuQEgNzaDnj5PHVA,ABDUL ALIM MOHAMMADI,2026,Türkiye\'de havza ölçeğinde CBS uygulaması ile olay temelli (bazlı) sediment verimin tahmınınde toprak erozyonu yetke ve metke modellerinin doğrulama çalışmaları / Validation studies of soil erosion models of rusle and musle in prediction of event based sediment yield with gis application at the watershed scale in Turkey,Türkiye\'de havza ölçeğinde CBS uygulaması ile olay temelli (bazlı) sediment verimin tahmınınde toprak erozyonu yetke ve metke modellerinin doğrulama çalışmaları,Validation studies of soil erosion models of rusle and musle in prediction of event based sediment yield with gis application at the watershed scale in Turkey,Ankara University,ANKARA ÜNİVERSİTESİ,İngilizce,Doktora,Ziraat = Agriculture,PROF. DR. GÜNAY ERPUL,FEN BİLİMLERİ ENSTİTÜSÜ,TOPRAK BİLİMİ VE BİTKİ BESLEME ANABİLİM DALI,,"Toprak erozyonu ve sedimentasyon, küresel ölçekte tarımsal üretkenlik, su kaynakları ve ekosistem sağlığı açısından ciddi tehdit oluşturan önemli çevresel sorunlardır. Su kaynaklı erozyon, eğimli araziler, hassas toprak yapısı, düzensiz yağış rejimleri ve seyrek bitki örtüsü ile karakterize bölgelerde yaygındır. İnsan kaynaklı etkiler, örneğin ormansızlaşma, sürdürülebilir olmayan tarım uygulamaları, aşırı otlatma ve kentleşme, erozyon sürecini hızlandırmaktadır. İklim değişikliği ise yağış rejimlerini ve şiddetini değiştirerek sürece katkıda bulunmaktadır. Bu faktörlerin birleşimi, toprak kaybını artırmakta olup arazi verimliliğini düşürmekte, su kaynaklarında sediment birikimine yol açmakta ve hem karasal hem de su ekosistemlerinin bozulmasına neden olmaktadır.Türkiye, yarı kurak iklimi, dik yamaçlı topoğrafyası, sığ toprakları ve düşük organik madde içeriği nedeniyle su kaynaklı erozyona karşı oldukça hassastır. Geleneksel tarım uygulamaları, aşırı otlatma ve seyrek bitki örtüsü toprak kaybını artırmaktadır. Ülkenin, Orta ve Doğu Anadolu ile Akdeniz bölgelerinde erozyon riski en yüksektir. Ulusal tahminlere göre Türkiye'de yılda yaklaşık 642 milyon ton toprak kaybolmakta ve toplam arazinin %12'sinden fazlası şiddetli erozyon tehdidi altındadır. Bu durum, etkin havza yönetimi ve sürdürülebilir arazi kullanım planlamasının önemini artırmaktadır. Toprak erozyonunu ve sediment verimini tahmin etmek için ampirik modeller yaygın olarak kullanılmaktadır. Bu çalışmada, Revize Evrensel Toprak Kayıpları Denklemi (YETKE) ve Modifiye Evrensel Toprak Kayıpları Denklemi (METKE) modelleri ele alınmıştır. YETKE, uzun dönemli ortalama toprak kaybını tahmin ederken METKE, olay temelli sediment verimi tahminine odaklanmakta ve belirli yağış olayları sırasında yüzey akışı hacmi ve pik debiyi kullanmaktadır. Her iki model de veri açısından sınırlı veya heterojen havzalarda bazı sınırlamalara sahiptir ve karmaşık yağış, akış, toprak ve arazi örtüsü etkileşimlerini tam olarak yansıtamayabilir. Son yıllarda uzaktan algılama, Coğrafi Bilgi Sistemleri (CBS) ve Makine Öğrenmesi (ML) alanlarındaki gelişmeler, bu modellerin öngörü performansını artırma potansiyeli sunmaktadır. Mekânsal sediment bağlantı indekslerinin entegrasyonu, sediment hareketini daha doğru bir şekilde modellemeye ve hidrolojik, topoğrafik ve arazi örtüsü değişkenleri arasındaki doğrusal olmayan etkileşimleri yakalamaya olanak tanımaktadır. Bu çalışmada, CBS tabanlı analiz ve ML yöntemleri ile geleneksel ampirik modeller birleştirilerek, özellikle heterojen veya veri açısından sınırlı havzalarda sediment verimi tahminlerinin güvenilirliği artırılmıştır. Araştırma, Kahramanmaraş ilinde Göksun Çayı havzasına bağlı Karaahmet alt havzasında gerçekleştirilmiştir. Alt havza yaklaşık 760 km²'lik bir alanı kapsamaktadır ve farklı topoğrafya ve erozyon hassasiyeti ile kıtasal iklim bölgelerini temsil etmektedir. Yıllık ortalama yağış 622 mm, yıllık ortalama sıcaklık 8 °C civarındadır. Topoğrafya dik yamaçlar, sığ topraklar ve heterojen bitki örtüsü ile karakterizedir. Model kalibrasyonu ve doğrulaması için meteorolojik kayıtlar, toprak etüt haritaları, 10 m çözünürlüklü Dijital Yükseklik Modeli (DEM) ve arazi örtüsü (LULC) verileri kullanılmıştır. Toprak erodibilitesi (K faktörü), LS (eğim dikliği ve uzunluğu) ve C (Ürün yönetim faktörü) faktörleri bu veriler üzerinden hesaplanmıştır. 196 alt havza ve 69 yağış olayı için kapsamlı bir veri seti oluşturulmuş ve model uygulamaları ArcGIS ve Google Earth Engine platformlarında gerçekleştirilmiştir. YETKE ve METKE modelleri, temel parametreler olan K, LS, C ve P kullanılarak uygulanmıştır olup. YETKE'de yağış erozivitesi (R faktörü) dikkate alınırken, METKE'de yüzey akış hacmi ve pik debi (Q×qp) kullanılmıştır. YETKE, olay bazlı sediment verimini doğrudan tahmin etmediğinden, Sediment Taşınım Oranı (STO) ile desteklenmiştir. Sediment taşınımını daha gerçekçi modellemek amacıyla, Sediment Bağlantılılık İndeksi (SCI) ve Bileşik Ağırlıklı Bağlantılılık İndeksi (CWCI) gibi mekânsal bağlantı indeksleri kullanılmıştır. Bu indeksler, eğim, akış birikimi, arazi örtüsü ve hidrolik bağlantılılığı dikkate alarak alt havza ölçeğinde sediment taşınımını değerlendirmiştir. Başlangıçta, YETKE ve METKE çıktılarına birbirine karşı regresyon analizi uygulanarak kalibrasyon yapılmıştır. İlk karşılaştırma orta düzeyde uyum göstermiş (R2 = 0,87), ancak regresyon tabanlı optimizasyon sonrasında iki model arasındaki uyum önemli ölçüde artırılarak R2 = 0,99 değerine ulaşılmıştır. Bu kalibrasyon, modellerin tutarlı ve karşılaştırılabilir hale getirilmesini sağlamıştır. Kalibrasyonun ardından modeller, gözlenen sediment verileri ile doğrulanmıştır. Belirleme katsayısı (R2) YETKE için 0,86, METKE için ise 0,84 bulunmuştur. Bu değerler, her iki modelin genel eğilimleri başarılı bir şekilde yakaladığını, ancak bazı bireysel olaylarda sapmalar içerdiğini göstermektedir. Bu doğrulama, ampirik modellerin gerçek koşullar altında olay bazlı sediment verimini temsil etme gücünü ve sınırlamalarını ortaya koymaktadır. Tahmin performansını daha da artırmak için, makine öğrenmesi algoritmaları (Random Forest, XGBoost ve Yapay Sinir Ağları) iki temel amaçla uygulanmıştır: (i) YETKE ve METKE'nin tahmin doğruluğunu artırmak, (ii) yalnızca bağlantılılık indekslerini kullanarak veri kısıtlı havzalarda alternatif sediment tahmini sağlamak. Hidrolojik, topoğrafik ve arazi örtüsü değişkenlerinin model çıktılarıyla entegrasyonu sayesinde ML modelleri yüksek öngörü doğruluğu elde etmiştir (R²=0,93–0,94). Bu değişkenler arasında SCI en etkili öngörücü olarak belirlenmiş, akışa dayalı parametreler ise sediment taşınımında kritik rol oynamıştır. Genel olarak, bu çalışma, YETKE ve METKE modellerinin CBS ve ML ile bütünleştirilmesinin olay bazlı sediment verimi tahmininde güçlü ve uygulanabilir bir metodoloji sağladığını göstermektedir. Yaklaşım, mekânsal ve zamansal değişkenliği yakalama, erozyon ve sediment taşınım süreçlerinin fiziksel temsiliyetini güçlendirme ve veri kısıtlı havzalara pratik alternatifler sunma açısından önemli katkılar sağlamaktadır. Gelecek çalışmalar için yüksek çözünürlüklü veri kullanımı, dinamik kalibrasyon ve uzaktan algılama teknolojilerinin entegrasyonu önerilmektedir.",False
995537,K2B0uvJ0EqVWTcJMvvWBog,OkuawkwpO4qScyZlNrt-lA,BURAK GÖKÇE,2026,Türkiye enerji piyasasının makine öğrenmesi uygulamasıyla düşük-karbon salımına geçişte ajan temelli modellenmesi / Turkish energy market agent-based modeling for low-carbon transition with machine learning application,Türkiye enerji piyasasının makine öğrenmesi uygulamasıyla düşük-karbon salımına geçişte ajan temelli modellenmesi,Turkish energy market agent-based modeling for low-carbon transition with machine learning application,Istanbul Technical University,İSTANBUL TEKNİK ÜNİVERSİTESİ,Türkçe,Doktora,Bilim ve Teknoloji = Science and Technology ; Enerji = Energy,PROF. DR. GÜLGÜN KAYAKUTLU,LİSANSÜSTÜ EĞİTİM ENSTİTÜSÜ,ENERJİ BİLİM VE TEKNOLOJİ ANABİLİM DALI,Elektrik piyasası = Electric market ; Enerji piyasası = Energy market ; Karbon emisyonu = Carbon emission ; Makine öğrenmesi = Machine learning ; Sıfır emisyon = Zero emission ; Yenilenebilir enerji kaynakları = Renewable energy resources ; Çok ajanlı sistemler = Multiagent systems,"The global shift toward low-carbon energy systems has intensified the need for analytical tools capable of capturing the complexity, interdependence, and long-term uncertainty of modern electricity markets. Traditional optimization or equilibrium-based models often fall short in representing heterogeneous decision-making processes, adaptive behavior, and policy-induced structural changes. In contrast, agent-based modeling (ABM) provides a bottom-up framework that simulates the interactions of decentralized actors such as generators, investors, consumers, and policymakers, thereby offering a powerful method to analyze transition pathways under evolving technological and regulatory conditions. As energy systems become increasingly data-rich and decentralized, machine learning (ML) methods have also gained prominence for learning and forecasting. The integration of ML techniques within ABM environments allows for more realistic, data-driven simulations that reflect both the behavioral and structural dynamics of contemporary energy markets.
Motivated by these developments, this thesis investigates Turkey's transition toward a low-carbon electricity system in the context of its 2053 net-zero target. Turkey's electricity market is undergoing rapid changes, driven by accelerated renewable deployment, planned nuclear expansion, evolving market mechanisms, and the upcoming introduction of a national emissions trading system (ETS). These dynamics create a unique environment that demands sophisticated modeling approaches capable of integrating long-term policy commitments, short-term market behavior, investment decision processes, and the interactions between thermal, renewable, and emerging technologies. Addressing these challenges, the thesis develops a comprehensive modeling platform that integrates econometric demand forecasting, ML-based price prediction, and an agent-based simulation framework capable of evaluating energy market evolution at hourly resolution.
The research begins with a systematic literature review to assess the current state of ABM and ML applications in energy systems. 65 academic articles published between 2014 and 2024 are examined and clustered using self-organizing maps (SOM). The clustering is based on attributes such as data type (real versus artificial), simulation horizon (short-term versus long-term), and ML contribution (agent learning versus exogenous prediction). The review reveals several key insights. First, although ABM has become a popular tool for modeling electricity market behavior, most studies focus on short-term bidding strategies and rely heavily on synthetic datasets. Second, ML integration typically centers on reinforcement learning (RL) to optimize strategic bidding, rather than using ML for system-level forecasting. Third, only a small number of studies investigate long-term dynamics such as investment decisions, policy evaluation, or carbon pricing. This review therefore highlights the need for long-term ABM frameworks that incorporate ML-based predictive models, real-world market data, and policy instruments relevant to emerging energy transitions.
To address these gaps, the thesis develops a multi-layered modeling architecture grounded in real and publicly accessible data from national and international sources. Hourly electricity demand and generation records, day-ahead market (DAM) prices, historical and projected fuel prices, installed capacity data, investment cost parameters, and renewable support scheme tariffs are compiled and processed using Python and SQL. The data pipeline includes missing value handling, anomaly detection, normalization, and structural validation to ensure consistency across historical data. This robust data foundation forms the backbone of the demand forecasting, price prediction, and investment modeling components.
The econometric component employs a Seasonal Autoregressive Integrated Moving Average (SARIMA) model to forecast Türkiye's long-term electricity demand. The model is trained on monthly demand data from 1975 to 2021. Validation against 2022 out-of-sample data yields a mean absolute percentage error (MAPE) of 3.5%, confirming the suitability of SARIMA for long-term forecasting. The monthly forecasts are subsequently disaggregated into hourly profiles that reflect historical intraday consumption patterns, producing realistic hourly demand inputs for the ABM simulations.
ML-based price prediction forms the second major methodological pillar. Three tree-based algorithms—CatBoost, XGBoost, and Random Forest—are trained on hourly market data from 2017 to 2020 and tested on 2021 data. Input features include fuel prices, renewable output, and residual demand. Among the models evaluated, CatBoost achieves the highest performance with a 6.09% MAPE and an annual mean error of 1.94%, outperforming other ML benchmarks and providing reliable hourly price forecasts. These model outputs feed into the ABM system to capture the impact of future fuel price variations, renewable expansion, and market conditions on day-ahead price formation.
The core ABM platform is implemented using AnyLogic and Python, simulating Turkey's electricity market from 2022 to 2053 under multiple scenarios. The model includes generator agents representing renewable, thermal, and nuclear power plants; investor agents making capacity decisions based on net present value (NPV) calculations; and a market operator agent representing Energy Exchange Istanbul (EXIST, EPİAŞ), responsible for DAM clearing and ETS operations where applicable. Investor agents operate under an economic rationality approach, using NPV evaluations to determine capacity additions or retirements. The model simulates generator bidding behavior based on marginal cost calculations that include fuel prices, operation and maintenance (O&M) costs, and carbon costs. The scenario engine enables hourly market clearing over the entire study horizon, capturing long-term dynamics such as price trends, emissions trajectories, investment flows, and generation mix evolution.
The scenario set encompasses a wide range of policy and demand trajectories. The Stated Policies Scenario includes planned nuclear expansion (Akkuyu) but no ETS implementation. The No-Nuclear case removes nuclear capacity to evaluate its counterfactual impact. The Emissions Trading Scenario introduces a national ETS from 2026 onward, with carbon prices aligned with the EU ETS trajectory. High and Low Demand Scenarios apply ±10% adjustments to the baseline demand forecast to assess system sensitivity. Additional sensitivity analysis include emission factor reductions for thermal plants, and discount rate changes between 4%, 6%, and 8% for NPV analysis.
The simulation results provide deep insights into Türkiye's potential energy transition pathways. Under Stated Policies, renewable energy generation share rises to 63.1% in 2053, driven primarily by large increases in solar and wind capacity. Solar PV and onshore wind jointly reach 35.8% of generation, enabled by declining technology costs and strong investor interest. Natural gas plants remains crucial for system flexibility, accounting for 14.8% of generation in 2053, while coal-based generation declines significantly. Total CO₂ emissions peak in 2038 at 147.2 Mt and then fall to 101.4 Mt by 2053—a 25.9% reduction from 2022 level. Nuclear power plays a strategically important role: excluding Akkuyu increases average prices by 6.28 USD/MWh and raises 2053 emissions by 20.2 Mt, demonstrating the value of low-carbon baseload capacity.
The Emissions Trading Scenario accelerates decarbonization. By adding carbon costs to marginal bids, ETS shifts dispatch decisions toward renewable and low-carbon resources, reducing emissions by an additional 8.4 Mt CO₂ in 2053 relative to the baseline. However, carbon pricing increases average wholesale market prices by 57.91 USD/MWh from 2026 onward. Sensitivity analysis reveals that reducing emission factors by 10% or 20% significantly mitigates these price effects, suggesting that efficiency improvements and partial abatement technologies could soften ETS-induced price shocks.
Demand uncertainty is another critical factor. In the High Demand Scenario, increased consumption requires greater reliance on natural gas, elevates average prices by 6.46 USD/MWh, and lowers renewable shares. In contrast, the Low Demand Scenario reduces prices by 7.11 USD/MWh and accelerates decarbonization by increasing renewable penetration to 68% in 2053. Regardless of scenario, emissions decline over time, indicating that Turkey's long-term decarbonization trajectory is robust, though its pace and cost vary.
Based on the simulation results, the thesis provides several actionable recommendations. Strengthening renewable support mechanisms by extending and enhancing existing programs is essential to maintaining investor confidence and accelerating renewable deployment. Facilitating affordable financing can further stimulate investment. Upgrading Türkiye's transmission and distribution networks, deploying energy storage, and digitalizing grid operations are critical for integrating high shares of variable renewables. Enhancing regional market integration with the EU can provide additional flexibility and cost efficiency. Implementing an ETS with transparent, predictable pricing rules aligned with the EU ETS would provide credible decarbonization signals. Demand-side measures, including stronger enforcement of energy efficiency obligations, widespread adoption of demand-response mechanisms, and deployment of smart grid technologies, are important for shaping demand patterns and mitigating the need for costly capacity expansions. Nuclear planning should continue with the timely commissioning of Akkuyu and the preparation of long-term strategies for additional nuclear capacity.
Methodologically, the thesis contributes an integrated energy system modeling framework that combines ABM, ML, and econometrics into a unified long-term simulation environment. The model uses real market data, transparent assumptions, and validated components, ensuring both empirical reliability and policy relevance. The future work can incorporate distributed generation, microgrids, battery storage systems, endogenous demand elasticity, more sophisticated representations of investor risk and behavioral heterogeneity, and generative AI for enhanced prediction and scenario generation.
In conclusion, this thesis demonstrates that integrating agent-based modeling with machine learning and econometric forecasting provides a powerful, data-driven, and flexible framework for assessing long-term energy market evolution under diverse policy and demand conditions. The findings show that renewable energy expansion, nuclear power deployment, carbon pricing mechanisms together form the cornerstone of Turkey's long-term decarbonization strategy. The model reveals that while Turkey can significantly reduce emissions under current policies, achieving deep decarbonization requires coordinated efforts across renewable support mechanisms, grid modernization, ETS implementation, nuclear planning, and demand management. The modeling framework developed in this thesis offers a comprehensive ex-ante decision-support tool for policymakers, investors, and market stakeholders, helping guide Türkiye's transition to a sustainable, secure, and low-carbon energy future.",True
