tez_no,thesis_key,encrypted_no,author,year,title,title_en,title_tr,university,university_raw,language,thesis_type,subject,advisor,institute,department,keywords,abstract,pdf_available
992943,rghS5NWOyu1oMZpkNv6DZw,174-IkXgu5ru5QD7VUd8wg,KERİM ALPER KAVUŞAN,2026,Identification of key gene pathways in alzheimer\'s diseaseusing machine learning methods on gene expression data / Gen ekspresyon verileriyle alzheimer risk tahmini ve yolak analizi,Identification of key gene pathways in alzheimer\'s diseaseusing machine learning methods on gene expression data,Gen ekspresyon verileriyle alzheimer risk tahmini ve yolak analizi,Istanbul Technical University,İSTANBUL TEKNİK ÜNİVERSİTESİ,İngilizce,Yüksek Lisans,Endüstri ve Endüstri Mühendisliği = Industrial and Industrial Engineering,PROF. DR. MEHMET GÜRAY GÜLER,LİSANSÜSTÜ EĞİTİM ENSTİTÜSÜ,ENDÜSTRİ MÜHENDİSLİĞİ ANABİLİM DALI,,"Alzheimer hastalığı (AD), yaşlanma ile ilişkili en yaygın nörodejeneratif hastalıklardan biri olup, küresel ölçekte artan hasta sayısı nedeniyle önemli bir halk sağlığı sorunu olarak değerlendirilmektedir. Klinik seyri yavaş ilerleyen ancak geri dönüşümsüz nöronal kayıpla sonuçlanan bu hastalık; hafıza, öğrenme, yürütücü işlevler ve davranışsal süreçlerde belirgin bozulmalarla karakterizedir. Günümüzde Alzheimer hastalığının kesin tanısı çoğunlukla ileri evrelerde konulabilmekte, bu durum erken müdahale ve tedavi olanaklarını ciddi biçimde sınırlamaktadır. Hastalığın altında yatan moleküler mekanizmaların karmaşıklığı ve bireyler arası biyolojik heterojenlik, hem tanısal biyobelirteçlerin hem de etkili tedavi stratejilerinin geliştirilmesini zorlaştıran temel etmenler arasında yer almaktadır.

Alzheimer hastalığının patofizyolojisi yalnızca tek bir biyolojik süreçle açıklanamamakta; aksine çok sayıda moleküler, hücresel ve sistemik mekanizmanın eş zamanlı ve etkileşimli biçimde rol oynadığı karmaşık bir yapı sergilemektedir. Amiloid beta birikimi ve tau proteinine bağlı patolojiler hastalığın klasik özellikleri arasında yer alsa da, son yıllarda yapılan çalışmalar nöroinflamasyon, metabolik bozukluklar, insülin sinyalizasyonundaki düzensizlikler, oksidatif stres ve kan-beyin bariyeri fonksiyonlarındaki değişimlerin de hastalık sürecine önemli katkılar sunduğunu göstermektedir. Bu çok boyutlu yapı, Alzheimer hastalığının yalnızca tekil genler veya proteinler üzerinden değil, biyolojik yolaklar ve ağlar düzeyinde ele alınmasını gerekli kılmaktadır.

Yüksek verimli dizileme teknolojilerindeki gelişmeler sayesinde, Alzheimer hastalığına ait transkriptomik gen ekspresyon verileri büyük ölçekli ve yüksek boyutlu veri setleri hâlinde elde edilebilmektedir. Bu veriler, hastalığa özgü gen regülasyon değişimlerini yansıtarak hem hastalık mekanizmalarının aydınlatılmasına hem de potansiyel biyobelirteçlerin keşfine olanak tanımaktadır. Bununla birlikte, transkriptomik verilerin yüksek boyutluluğu, gürültü içermesi ve biyolojik örnekler arasındaki heterojenlik, klasik analiz yöntemlerinin sınırlı kalmasına yol açmaktadır. Bu bağlamda, makine öğrenmesi tabanlı yaklaşımlar, karmaşık örüntüleri yakalayabilme ve çok değişkenli ilişkileri modelleyebilme yetenekleri sayesinde öne çıkmaktadır.

Bu çalışmanın temel amacı, Alzheimer hastalığına ait gen ekspresyon verilerini kullanarak, makine öğrenmesi tabanlı sınıflandırma modelleri ile biyolojik yolak düzeyinde yorumlanabilirlik sağlayan analizleri bütünleşik bir çerçeve içerisinde değerlendirmektir. Çalışma, yalnızca yüksek doğruluk veya sınıflandırma başarımı elde etmeyi hedeflememekte; aynı zamanda elde edilen sonuçların biyolojik açıdan anlamlı, tutarlı ve açıklanabilir olmasını amaçlamaktadır. Bu yaklaşım, hesaplamalı performans ile biyolojik içgörü üretimi arasındaki dengenin korunmasını merkeze almaktadır.

Analizlerde, Alzheimer hastalığına ait farklı doku ve örnek tiplerinden elde edilmiş transkriptomik veri setleri kullanılmıştır. Veri setleri üzerinde Rastgele Ağaçlar (Random Forest – RF), Destek Vektör Makineleri (Support Vector Machines – SVM) ve Çok Katmanlı Algılayıcı (Multi-Layer Perceptron – MLP) gibi farklı makine öğrenmesi algoritmaları uygulanmıştır. Bu modeller, doğrusal olmayan ilişkileri yakalayabilme, yüksek boyutlu verilerle etkin biçimde çalışabilme ve karmaşık karar sınırları oluşturabilme kapasiteleri nedeniyle tercih edilmiştir. Her bir model, Alzheimer hastalığına sahip bireyler ile kontrol gruplarını ayırt etme amacıyla eğitilmiş ve performansları karşılaştırmalı olarak değerlendirilmiştir.

Modelleme sürecinde, aşırı uyum riskini azaltmak ve elde edilen sonuçların genellenebilirliğini artırmak amacıyla çoklu tekrarlar içeren iç içe geçmiş çapraz doğrulama (nested cross-validation) yapısı kullanılmıştır. Bu yaklaşım sayesinde, hiperparametre optimizasyonu ile model performansının değerlendirilmesi birbirinden ayrılmış ve model seçim süreci daha objektif hâle getirilmiştir. Hiperparametre optimizasyonunun Bayesian temelli bir çerçeve aracılığıyla gerçekleştirilmesi, arama uzayının daha etkin biçimde taranmasını sağlamış ve hesaplama maliyeti ile model başarımı arasında dengeli bir çözüm sunmuştur. Optuna tabanlı optimizasyon süreci, rastgele veya ızgara tabanlı arama yöntemlerine kıyasla, daha az deneme ile daha kararlı performans sonuçları elde edilmesine olanak tanımıştır. Bu yaklaşım, özellikle çoklu tekrarlar içeren çapraz doğrulama yapılarıyla birlikte kullanıldığında, modelleme sürecinin tekrarlanabilirliğini ve güvenilirliğini artırmaktadır.

Model performansları doğruluk, AUC, hassasiyet, duyarlılık ve F1-skoru gibi çoklu metrikler üzerinden değerlendirilmiştir. Bu çok boyutlu değerlendirme yaklaşımı, özellikle sınıf dengesizliğinin söz konusu olduğu biyomedikal veri setlerinde model başarımının daha gerçekçi biçimde yorumlanmasına olanak tanımıştır. Elde edilen sonuçlar, kullanılan makine öğrenmesi yöntemlerinin Alzheimer hastalığına ait transkriptomik veriler üzerinde anlamlı ve tutarlı bir ayırt edicilik gücüne sahip olduğunu göstermiştir.

Çalışmada değerlendirilen farklı makine öğrenmesi modelleri, Alzheimer hastalığına ait gen ekspresyon verileri üzerinde benzer performans seviyeleri sergilese de, her bir modelin veri yapısına verdiği tepkiler ve öne çıkan özellikleri farklılık göstermiştir. Ağaç tabanlı modeller, değişken önemleri üzerinden daha sezgisel yorumlar sunarken, çekirdek tabanlı ve sinir ağı temelli modeller daha karmaşık örüntüleri yakalama konusunda avantaj sağlamıştır. Bu durum, tek bir ""en iyi model"" yaklaşımı yerine, farklı modellerin tamamlayıcı bakış açıları sunduğunu göstermektedir.

Hesaplamalı sonuçların biyolojik bağlamda anlamlandırılabilmesi amacıyla, gen ekspresyon verileri yolak düzeyinde analiz edilmiştir. Bu kapsamda, Hallmark gen setleri kullanılarak biyolojik süreçlerin daha kompakt, indirgenmiş ve yorumlanabilir temsilleri elde edilmiştir. Literatürde yaygın olarak kullanılan GSEA ve GSVA tabanlı yaklaşımlar incelenmiş; bu yöntemlerin Alzheimer hastalığı bağlamındaki güçlü yönleri ve sınırlılıkları değerlendirilmiştir. Gen seti örtüşme analizleri aracılığıyla, model çıktıları ile bilinen biyolojik süreçler arasındaki ilişkiler detaylı biçimde incelenmiştir.

Yolak düzeyindeki analizler, Alzheimer hastalığının patofizyolojisinde rol oynayan temel biyolojik mekanizmaların belirgin biçimde ortaya çıktığını göstermiştir. Özellikle inflamatuvar yanıtlar, immün sistem aktivasyonu ve mikroglial yanıtlar hastalıkla güçlü biçimde ilişkilendirilmiştir. Bunun yanı sıra, kan-beyin bariyerinin geçirgenliğinin düzenlenmesi, insülin ve glukoz metabolizması ile ilişkili yolaklar ve hücresel stres yanıtları dikkat çekici bulgular arasında yer almıştır. Bu sonuçlar, Alzheimer hastalığının yalnızca merkezi sinir sistemiyle sınırlı bir hastalık olmadığını, sistemik biyolojik süreçlerle yakın ilişkili olduğunu desteklemektedir.

Çalışmada ayrıca, makine öğrenmesi modellerinden elde edilen sonuçların biyolojik tutarlılığı değerlendirilmiştir. Model tabanlı sınıflandırma çıktılarının, literatürde Alzheimer hastalığı ile ilişkilendirilmiş biyolojik süreçlerle uyumlu olması, geliştirilen analiz çerçevesinin açıklanabilirlik ve güvenilirlik boyutunu güçlendirmiştir. Bu durum, makine öğrenmesi yöntemlerinin biyomedikal alanda yalnızca ""tahmin eden"" araçlar değil, aynı zamanda biyolojik hipotezlerin test edilmesine ve yeni hipotezlerin üretilmesine katkı sağlayan analitik yöntemler olarak da kullanılabileceğini göstermektedir.

Özetle, bu çalışma Alzheimer hastalığına ait transkriptomik veriler üzerinde uygulanan makine öğrenmesi tabanlı yaklaşımların, yalnızca sınıflandırma performansı açısından değil, aynı zamanda biyolojik yolak düzeyinde açıklanabilir ve güvenilir çıkarımlar üretme potansiyeline sahip olduğunu ortaya koymaktadır. Genel olarak değerlendirildiğinde, bu çalışma Alzheimer hastalığına ait transkriptomik verilerin analizinde, makine öğrenmesi ve yolak temelli biyolojik yorumlamayı bir araya getiren kapsamlı ve dengeli bir metodolojik çerçeve sunmaktadır. Önerilen yaklaşım, yalnızca mevcut veri setleriyle sınırlı kalmayıp, ileride farklı omik katmanların ve klinik değişkenlerin entegrasyonuna da olanak sağlayabilecek esnek bir yapıdadır. Bu yönüyle çalışma, Alzheimer hastalığının moleküler temellerinin daha derinlemesine anlaşılmasına katkı sunmayı amaçlayan gelecekteki araştırmalar için güçlü bir metodolojik referans oluşturmaktadır.",True
990242,fOtEOnu_F9wg_UNke4EkWg,Lruw5GsdxP3BS2MRjxgYzw,İLAY NUR TÜMER,2026,Orman yangınlarının mekânsal dağılımı ve hava kalitesine etkilerinin uydu verileri ve makine öğrenme yöntemleri ile analizi: 2025 Türkiye ve kaliforniya (LA) yangınları / Analysis of spatial distribution of forest fires and their impacts on air quality using satellite data and machine learning methods: 2025 turkey and california (LA) fires,Orman yangınlarının mekânsal dağılımı ve hava kalitesine etkilerinin uydu verileri ve makine öğrenme yöntemleri ile analizi: 2025 Türkiye ve kaliforniya (LA) yangınları,Analysis of spatial distribution of forest fires and their impacts on air quality using satellite data and machine learning methods: 2025 turkey and california (LA) fires,Istanbul Technical University,İSTANBUL TEKNİK ÜNİVERSİTESİ,Türkçe,Yüksek Lisans,Jeodezi ve Fotogrametri = Geodesy and Photogrammetry,PROF. DR. ELİF SERTEL,LİSANSÜSTÜ EĞİTİM ENSTİTÜSÜ,GEOMATİK MÜHENDİSLİĞİ ANABİLİM DALI,,"Forests are natural ecosystems covers approximately 31% of the Earth's land surface and play a critical role in maintaining the continuity of the global ecosystem. They are indispensable for ecological balance due to their capacity to sequester atmospheric carbon dioxide, contribute to oxygen production, and provide habitats for biodiversity. Forests also play an important role in sustaining the hydrological cycle, mitigating soil erosion, and regulating local climatic conditions.
In recent years, a significant increase has been observed in both the frequency and intensity of forest fires. This increase is primarily attributed to rising temperatures, prolonged drought conditions, strong wind events, and human activities. The escalation of wildfire activity has been particularly pronounced in fire-prone regions such as the Mediterranean Basin. Large-scale fires cause the loss of forest resources and accelerate climate change by releasing greenhouse gases into the atmosphere.
During forest fires, large amounts of gases and particles are released into the atmosphere. Among these emissions, nitrogen dioxide and carbon monoxide are prominent trace gases. Nitrogen dioxide is a reactive compound closely associated with combustion processes and can promote ozone formation through photochemical reactions, thereby degrading air quality. Carbon monoxide, on the other hand, is a major product of incomplete combustion and influences ozone formation and methane lifetime through its interaction with hydroxyl radicals in the troposphere.
Exposure to these pollutants is directly linked to respiratory and cardiovascular diseases, leading to serious health impacts, especially among vulnerable populations. Hence, reliable analysis of the spatial and temporal patterns of fire related air pollution is important for environmental management and public health protection.
Accurate assessment of wildfire impacts on air quality depends primarily on the timely and precise detection of burned areas. The location, extent, and burn severity of fire-affected areas directly determine the distribution of emitted pollutants. Ground-based air quality monitoring stations provide high accuracy measurements; however, their limited spatial coverage constrains the representation of large-scale and spatially heterogeneous wildfire events.
Remote sensing satellite data offer a strong alternative in this context. Their ability to cover large areas and provide regular, continuous observations represents a major advantage. Multispectral sensors such as Sentinel-2A/B and Landsat-8/9 enable the comparison of pre- and post-fire conditions, allowing burned areas to be delineated using spectral indices such as dNBR, dNDVI, and dNDMI. These indices also support the classification of burn severity.
For monitoring atmospheric components, the TROPOMI sensor aboard the Sentinel-5P satellite plays a key role by providing daily observations of tropospheric column densities of pollutants such as nitrogen dioxide and carbon monoxide. However, satellite derived column measurements do not directly represent ground level concentrations, and their relationship with ground observations is influenced by various environmental factors, including meteorological conditions, topography, and land cover.
ERA5-Land reanalysis products contribute to modeling this complex relationship by providing meteorological variables such as air temperature, wind speed and direction, surface pressure, and solar radiation at high temporal resolution. These variables play a significant role in explaining the linkage between satellite observations and ground-based air quality measurements.
In this context, machine learning methods provide an effective framework for capturing nonlinear relationships between satellite observations, meteorological variables, and environmental factors to estimate ground level air quality. However, their black-box nature often limits interpretability. Explainable artificial intelligence techniques, particularly SHAP, address this limitation by quantifying the contribution of individual variables to model predictions.
This thesis investigates the impacts of forest fires on ground-level air quality using an explainable modeling framework. Burned areas are identified through spectral indices, and ground-level concentrations of nitrogen dioxide and carbon monoxide during fire periods are estimated using integrated satellite and meteorological data. The generalizability and physical consistency of the developed models are evaluated through SHAP based analysis.
Two study areas are defined: Western and Southwestern Anatolia in Türkiye, and the state of California in the United States. The Türkiye study area includes the provinces of İzmir, Aydın, Muğla, Antalya, Burdur, Isparta, Denizli, Afyonkarahisar, Uşak, Manisa, Balıkesir, Bilecik, Bursa, Çanakkale, Yalova, Kocaeli, Sakarya, Tekirdağ, Kırklareli, and Edirne. This region was selected based on the continuity and spatial distribution of ground monitoring stations and is characterized by coastal meteorological influences, diverse vegetation cover, and pronounced topographic variability, allowing for representative analysis of fire dynamics and pollutant dispersion.
California was selected due to its frequent large-scale wildfires and well-established air quality monitoring infrastructure, providing an appropriate second study area for testing the proposed methods under different environmental conditions.
Burned area detection was performed using Sentinel-2 and Landsat-8/9 imagery. Cloud and water masking were applied during preprocessing, followed by the creation of pre- and post-fire mosaics. dNBR classification was conducted based on USGS threshold values, while dNDVI and dNDMI were used as supporting indicators of vegetation and moisture loss. During the 2025 fire season in Türkiye, the total burned area was estimated as 101,503.99 hectares using Sentinel-2 data and 100,058.78 hectares using Landsat-8/9 data.
In the Los Angeles region of California, the Palisades, Eaton, Kenneth, Hurst, Lidia, Sunset, and Archer fires were analyzed. Sentinel-2 data indicated a total burned area of approximately 41000 acres, with the Palisades fire accounting for about 24280 acres and the Eaton fire for approximately 14489 acres.
Air quality variables were obtained from Sentinel-5P TROPOMI OFFL products via Google Earth Engine. Tropospheric column densities of nitrogen dioxide and carbon monoxide were converted from mol/m² to µmol/m². Meteorological auxiliary variables were extracted from the ERA5-Land Hourly dataset and included air temperature, dew point temperature, surface solar radiation, wind speed, wind direction, surface pressure, total precipitation, total evaporation, surface albedo, high and low vegetation leaf area index. Topographic effects were represented using the 30-m resolution TanDEM-X digital elevation model.
Ground-based air quality data were obtained from the National Air Quality Monitoring Network for Türkiye and from the EPA AirData database for California. In the Türkiye study area, 98 stations were used for the period 15 May–30 July 2025, with 90 stations measuring nitrogen dioxide and 55 measuring carbon monoxide. Measurements were matched to satellite overpass times using the 09:00–12:00 local time window.
For California, data from 1 January–30 July 2025 were analyzed, including 52 nitrogen dioxide stations and 30 carbon monoxide stations. Measurements from 19:00–22:00 UTC were used to represent satellite overpass conditions.
Datasets were filtered to remove missing values and physically implausible negative observations. The Türkiye nitrogen dioxide dataset was structured to capture both background conditions and fire-related peaks, retaining observations within the 10th and 90th percentiles. The final dataset consisted of 3,135 observations, with a Pearson correlation of 0.637 between satellite-based and ground-based nitrogen dioxide. For carbon monoxide, 1,728 observations were retained, yielding a correlation of 0.411.
The California nitrogen dioxide dataset consisted of 5,055 observations, with a correlation of 0.709, while the carbon monoxide dataset included 2,498 observations with a correlation of 0.252. The California nitrogen dioxide dataset was split into 80% training (4,169 observations) and 20% testing (1,043 observations).
To assess the thermal effects of fires in California, ECOSTRESS land surface temperature data with 70-m spatial resolution were used. These data supported the spatial characterization of thermal anomalies during major fires in the Los Angeles region and were treated as a complementary layer representing the thermal component of burn severity.
For the NO₂ parameter, the best performance in the Türkiye study area was achieved using the CatBoost model, with a test R² value of 0.808 and a test RMSE of 6.644 µg/m³. The LightGBM model provided comparable accuracy, whereas the LSTM model yielded the lowest performance and did not produce meaningful results. In the California study area, the CatBoost (R² = 0.863, RMSE = 4.249 µg/m³) and LightGBM (R² = 0.850, RMSE = 4.411 µg/m³) models also outperformed the other approaches, indicating their strong capability to represent complex and nonlinear relationships. Although the LSTM model showed relatively improved performance in California, it remained inferior to the other models, and visual inspection of the prediction maps further suggested that it did not produce meaningful spatial patterns.
For the CO parameter, the highest performance in the Türkiye study area was obtained with the Gradient Boosting model, achieving a test R² of 0.833 and a test RMSE of 168.851 µg/m³. The LightGBM model yielded comparable results with a test R² of 0.820 and an RMSE of 175.328 µg/m³. In the California study area, the LightGBM model demonstrated the best performance for CO, with a test R² of 0.792 and an RMSE of 55.938 µg/m³. The CatBoost and Gradient Boosting models produced consistent results across both study areas.
SHAP analysis revealed that satellite derived nitrogen dioxide was the most influential explanatory variable in both study areas. Elevation consistently showed a significant contribution, while leaf area index variables exhibited moderate effects. Meteorological variables generally played a secondary role, with contributions varying depending on conditions. Local SHAP explanations indicated that satellite nitrogen dioxide and topography strongly increased predictions in certain cases, while some meteorological variables exerted balancing effects. These findings indicate that the models capture relationships consistent with underlying physical processes.
In addition, within the scope of the transfer learning approach, models trained in the California study area were applied to major wildfire events in Türkiye. The CatBoost model trained in California was used to estimate ground-level NO₂ concentrations for the Bursa and İzmir fires, and the generalizability of the developed models was evaluated.
Furthermore, the GRIDMET and ERA5-Land meteorological datasets were comparatively assessed in this study. The performance of machine learning models developed using both datasets, along with their SHAP-based explainability results, were analyzed. The findings indicate that there were no substantial differences between the two datasets in terms of key performance metrics such as R² and RMSE. However, an examination of the spatial prediction maps revealed that the results obtained using the GRIDMET dataset exhibited more detailed and smoother spatial patterns due to its higher spatial resolution. SHAP analysis further showed that, regardless of the meteorological dataset used, the models relied on similar explanatory variables to generate predictions.
In conclusion, this study demonstrates that surface-level nitrogen dioxide and carbon monoxide concentrations during wildfire periods can be effectively estimated by integrating satellite observations, meteorological auxiliary data, and machine learning methods. Tree-based boosting models showed superior accuracy and robustness, while SHAP analysis enhanced model interpretability. The ability to capture similar processes across distinct geographic regions such as Türkiye and California indicates the generalizability of the proposed approach and highlights the value of multi-source data integration for analyzing wildfire air quality interactions.",True
