tez_no,thesis_key,encrypted_no,author,year,title,title_en,title_tr,university,university_raw,language,thesis_type,subject,advisor,institute,department,keywords,abstract,pdf_available
989774,zQSsn-gmZL3dlvO99g7q1w,A4vnU_PGWHdyvK0-30tFdw,ONURCAN GÜNDOĞAN,2026,Çamaşır makinesinde yapay sinir ağları ile dengesiz yük miktarı tahmini / Estimation of unbalanced load weight in a washing machine using artificial neural networks,Çamaşır makinesinde yapay sinir ağları ile dengesiz yük miktarı tahmini,Estimation of unbalanced load weight in a washing machine using artificial neural networks,Yıldız Technical University,YILDIZ TEKNİK ÜNİVERSİTESİ,Türkçe,Yüksek Lisans,Elektrik ve Elektronik Mühendisliği = Electrical and Electronics Engineering,PROF. DR. AHMET FARUK BAKAN,FEN BİLİMLERİ ENSTİTÜSÜ,ELEKTRİK MÜHENDİSLİĞİ ANABİLİM DALI,,"An unbalanced load is a mass displacement caused by the uneven distribution of laundry inside the drum, and it leads to serious problems such as severe vibration, noise, and a shortened lifespan of machine components, especially during high-speed spinning. Accurate knowledge of this load amount is vital for implementing active balancing systems, which are more efficient than passive methods. The model developed in this thesis adopts a sensorless approach, eliminating the need for external accelerometers or load sensors, which increase cost and raise the risk of failure. The theoretical basis for this approach relies on the direct interaction between the washing machine's mechanical and electrical systems. The mechanical mass imbalance in the drum creates a periodic oscillatory force (F_unbalanced = m_unbalanced*r_d*omega^2) and a corresponding load torque during rotation. Modern motor control systems (FOC), in order to maintain a constant drum speed, demand an oscillating electromagnetic torque to counter this oscillating load torque. This torque demand causes periodic fluctuations in the motor's q-axis current (iq), which can be directly measured. Consequently, the imbalance, a purely mechanical phenomenon, becomes monitorable through the motor's internal electrical signals. In the literature, various sensor-based and sensorless methods have been investigated to detect unbalanced loads. Sensorless methods primarily include model-based observers (e.g., Sliding Mode Observer) based on the system's mathematical model, hybrid AI systems (e.g., Fuzzy Logic + ANN) based on expert knowledge, and deep learning approaches (e.g., RNN, NARX) that analyze motor signals as time series. These methods differ in terms of interpretability, computational load, and potential accuracy. Three key features extracted from the signal—rather than the raw torque signal—are fed into the ANN model: RMS (Root Mean Square, indicating the signal's energy level), Peak-to-Peak (p2p) (the difference between maximum and minimum values, providing amplitude information), and Mean (the average level of the signal). A windowing process was applied to the time-series data to capture the signal's changes over time, provide a fixed-size input for the ANN, and augment the dataset. The developed ANN architecture is a feed-forward structure. The model has an input layer with 3 neurons (RMS, P2P, Mean), two hidden layers with 96 and 48 neurons, respectively, and an output layer with 1 neuron. This gradual narrowing (a funnel structure) of 96 -> 48 helps the network first learn complex patterns and then reduce this information to a more compact representation, which helps prevent overfitting and increases its generalization capability. The hyperbolic tangent activation function was chosen for the hidden layers due to its ability to model symmetric fluctuations in signals (in the -1 to +1 range); the linear activation function was preferred for the output layer for continuous value (regression) estimation. A critical point in the model's training is the very wide load range, from 0 to 2000 grams. If estimating grams directly, there is a risk that the model might ignore large proportional errors at small loads (e.g., at 10 grams) and focus only on large loads. To overcome this problem, a logarithmic transformation was applied. The model was trained to predict the log(1 + weight) value instead of the weight directly. This transformation compresses the wide data range (the 0--2000g range compresses to 0--7.6 in logarithmic space), making the model more sensitive to changes, especially at small loads. The +1 addition in the formula is used so that the logarithm of a 0-gram load can be taken (as log(0) is undefined). The model's logarithmic output (y_log) is converted back to grams using the inverse transformation formula w_unbalanced = exp(y_log) - 1. The Scaled Conjugate Gradient (SCG) algorithm was used for network training, as it is fast and memory-efficient for large datasets. SCG is an advanced optimization technique that reduces the risk of getting stuck in local minima by considering previous steps, unlike classic gradient descent algorithms. Experimental studies have shown that the developed ANN model offers high accuracy, with a maximum absolute error of around 1%. These findings prove that a sensorless approach can exhibit industrially acceptable performance and holds promise for low-cost, reliable, and maintenance-free systems in washing machines. For future work, it is recommended to diversify the dataset with different load distributions and rotational speeds, test different deep learning architectures such as RNNs or CNNs, and integrate the model into embedded systems to evaluate its real-time performance.",True
997275,6CX1daRazOBQ_pwIpuB6-w,OiApa6Pr2qdER9_dBVD9gQ,MERVE ERŞAN,2026,Fusion of RGB and thermal image pairs for object and face liveness detection / Nesne ve yüz canlılığı tespiti için RGB ve termal görüntü çiftlerinin birleştirilmesi,Fusion of RGB and thermal image pairs for object and face liveness detection,Nesne ve yüz canlılığı tespiti için RGB ve termal görüntü çiftlerinin birleştirilmesi,Istanbul Technical University,İSTANBUL TEKNİK ÜNİVERSİTESİ,İngilizce,Yüksek Lisans,Elektrik ve Elektronik Mühendisliği = Electrical and Electronics Engineering,PROF. DR. TAYFUN AKGÜL,LİSANSÜSTÜ EĞİTİM ENSTİTÜSÜ,ELEKTRONİK VE HABERLEŞME MÜHENDİSLİĞİ ANABİLİM DALI,,"Bilgisayarlı görü ve yapay zekâ tabanlı algılama sistemleri, son yıllarda hem akademik araştırmalar hem de endüstriyel uygulamalar açısından büyük bir ivme kazanmıştır. Otonom sürüş sistemleri, akıllı gözetleme altyapıları, biyometrik kimlik doğrulama çözümleri, sınır güvenliği, askeri uygulamalar ve arama-kurtarma operasyonları gibi pek çok kritik alanda kullanılan bu sistemlerden, farklı çevresel ve operasyonel koşullar altında güvenilir ve tutarlı bir performans sergilemeleri beklenmektedir. Ancak gerçek dünya ortamları, değişken ve yetersiz aydınlatma koşulları, karanlık ortamlar, sert gölgeler, duman, sis veya yağmur gibi atmosferik etkiler, karmaşık sahne yapıları ve kısmi engeller gibi çok sayıda zorluğu bir arada barındırmaktadır. Bu durum, tek bir algılama yöntemine dayanan geleneksel bilgisayarlı görü sistemlerinin performansını ciddi biçimde sınırlandırmakta ve bu sistemlerin gerçek dünya senaryolarında güvenilirliğini azaltmaktadır.

Görünür spektrum kameralar, yüksek çözünürlük, zengin renk ve doku bilgileri sayesinde nesne algılama, sınıflandırma ve yüz tespiti gibi görevlerde yüksek doğruluk sağlayabilmektedir. Bununla birlikte, RGB tabanlı algılama sistemlerinin başarımı büyük ölçüde ortam aydınlatmasına bağlıdır. Düşük ışık, gece koşulları veya yoğun gölgelerin bulunduğu sahnelerde RGB görüntülerdeki görsel bilgi ciddi biçimde bozulmakta; kontrast kaybı, gürültü artışı ve detay eksikliği gibi sorunlar ortaya çıkmaktadır. Bu durum, derin öğrenme tabanlı modellerin bile algılama performansında belirgin düşüşlere yol açabilmektedir. Termal kameralar ise ortam ışığından bağımsız olarak nesnelerin yaydığı kızılötesi radyasyonu algılayabildiğinden, karanlık veya görsel olarak zorlayıcı koşullarda daha kararlı bir algılama sunmaktadır. Bununla birlikte, termal görüntüler sensör teknolojilerinin doğası gereği genellikle düşük çözünürlüklüdür ve nesnelerin geometrik yapısını ve sınır detaylarını yeterince temsil edememektedir. Bu nedenle yalnızca termal görüntülere dayalı sistemler, hassas konumlandırma ve ayrıntılı şekil bilgisi gerektiren görevlerde sınırlı performans sergilemektedir.

RGB ve termal görüntüleme kiplerinin bu tamamlayıcı özellikleri, iki kipin birlikte kullanıldığı çok kipli (multimodal) algılama sistemlerini güçlü bir alternatif hâline getirmektedir. Ancak RGB-T sistemlerin başarımı, yalnızca iki farklı sensörün birlikte kullanılmasına değil, bu sensörlerden elde edilen bilgilerin nasıl birleştirildiğine de doğrudan bağlıdır. Literatürde erken seviye, orta seviye ve geç seviye füzyon yaklaşımları gibi pek çok farklı strateji önerilmiş olsa da, bu yöntemlerin önemli bir bölümü karmaşık ağ mimarileri, çok dallı yapılar ve yüksek hesaplama maliyeti gerektiren öğrenmeye dayalı füzyon mekanizmalarına dayanmaktadır. Bu durum, sistemlerin gerçek zamanlı uygulamalarda kullanılmasını zorlaştırmakta ve füzyon sürecinin yorumlanabilirliğini azaltmaktadır.

Bu tez çalışmasında, RGB ve termal görüntülerin birlikte kullanıldığı, sade ancak etkili bir görsel algılama çerçevesi geliştirilmiştir. Çoklu sensör sistemlerinde sıkça karşılaşılan zamanlama ve senkronizasyon problemlerini ortadan kaldırmak amacıyla, tüm veriler eşzamanlı RGB ve termal görüntü elde edebilen hibrit bir kamera sistemi kullanılarak toplanmıştır. Bu yaklaşım sayesinde zaman uyumsuzluğundan kaynaklanan belirsizlikler büyük ölçüde azaltılmıştır. Bununla birlikte, RGB ve termal sensörler arasındaki optik yapı, görüş açısı ve çözünürlük farklılıkları, füzyon öncesinde hassas geometrik hizalama gerektirmektedir. Bu nedenle nesne algılama senaryolarında stereo kamera kalibrasyonu uygulanmış; kamera iç ve dış parametreleri tahmin edilerek görüntü rektifikasyonu gerçekleştirilmiş ve iki görüntüleme türü arasında piksel seviyesinde geometrik tutarlılık sağlanmıştır.

Tezin temel katkısı RGB görüntülerden elde edilen kenar bilgisinin, hizalanmış termal görüntülerle doğrusal ağırlıklı bir füzyon denklemi kullanılarak birleştirilmesidir. RGB görüntülerden çıkarılan kenar bilgisi, sahnedeki nesnelerin geometrik yapısını, sınırlarını ve yapısal sürekliliğini yüksek doğrulukla temsil ederken; termal görüntüler, aydınlatmadan bağımsız ısı dağılımı bilgisi sunmaktadır. Bu iki bilginin tek bir hibrit görüntü içerisinde birleştirilmesi, hem yapısal hem de termal ipuçlarını aynı anda içeren zengin bir temsil ortaya koymaktadır. Önerilen yaklaşımla oluşturulan görüntüler, karmaşık öğrenmeye dayalı füzyon ağlarına ihtiyaç duymadan, doğrudan standart YOLO tabanlı algılama modellerine giriş olarak kullanılabilmektedir. Bu durum, hem hesaplama maliyetini düşürmekte hem de füzyon sürecinin şeffaf ve yorumlanabilir olmasını sağlamaktadır.

Deneysel değerlendirmeleri desteklemek amacıyla bu tez kapsamında iki özgün RGB-T veri kümesi toplanmıştır. ARISTO veri kümesi, hem iç hem de dış mekânları kapsayan gerçek RGB-T nesne algılama veri kümesidir. Veri kümesi, farklı sahne tipleri, mesafeler ve çevresel koşullar altında toplanmış görüntüler içermektedir. İç mekân sahnelerinde 23, dış mekân sahnelerinde ise 16 olmak üzere geniş bir nesne sınıfı çeşitliliği sunmaktadır. Bildiğimiz kadarıyla, ARISTO veri kümesi, literatürde kamuya açık az sayıdaki iç mekân RGB-T veri kümelerinden biri olmasının yanı sıra, dış mekânlarda da yüksek sınıf çeşitliliği sunmasıyla dikkat çekmektedir. İkinci veri kümesi olan ARISTOF ise yüz canlılık tespiti amacıyla özel olarak toplanmış olup, canlı ve sahte yüz örneklerinden oluşmaktadır. Bu veri kümesi, statik sunum saldırılarına karşı RGB-T tabanlı yaklaşımların davranışını ayrıntılı biçimde incelemek üzere toplanmıştır. Gizlilik ve kişisel veri koruma mevzuatları gereği ARISTOF veri kümesi yalnızca bu tez kapsamında deneysel amaçlarla kullanılmıştır.

Gerçek RGB-T veri kümelerinin sınırlı ölçeği, derin öğrenme tabanlı modellerin genellenebilirliğini kısıtlayan önemli bir faktördür. Bu nedenle tez kapsamında sentetik termal veri üretimi ayrıntılı biçimde ele alınmıştır. Büyük ölçekli COCO RGB veri kümesi kullanılarak iki farklı sentetik termal üretim stratejisi uygulanmıştır. İlk stratejide, RGB görüntülerden SSI-Depth yöntemi ile tahmin edilen derinlik haritaları termal benzeri temsiller olarak değerlendirilmiştir. Bu yaklaşım, sahne geometrisini koruyarak nesne sınırlarının belirginleşmesini sağlamaktadır. İkinci stratejide ise, GAN tabanlı RGB'den termale görüntü dönüşüm modelleri kullanılarak görsel olarak daha gerçekçi ve termal karakteristiği güçlü sentetik görüntüler üretilmiştir. Her iki yöntemle elde edilen sentetik termal görüntüler, RGB'den çıkarılan kenar bilgisi ile aynı füzyon stratejisi kullanılarak birleştirilmiş ve büyük ölçekli hibrit eRGB-T veri kümeleri oluşturulmuştur.

Nesne algılama deneyleri, YOLOv8 modeli kullanılarak hem gerçek hem de sentetik veri kümeleri üzerinde kapsamlı biçimde gerçekleştirilmiştir. Deneysel sonuçlar, termal görüntülerle eğitilen modellerin yapısal detay eksikliği nedeniyle düşük doğruluk ve geri çağırım değerleri sergilediğini açıkça ortaya koymaktadır. RGB tabanlı modeller yüksek doğruluk sağlamakla birlikte, özellikle düşük ışık ve zor aydınlatma koşullarında kararlılık kaybı yaşamaktadır. Önerilen kenar çıkarımlı RGB-T füzyon temsili ise, termal girdilere kıyasla belirgin performans artışı sağlamış ve birçok senaryoda RGB modellerle karşılaştırılabilir mAP@50 değerlerine ulaşmıştır. Sentetik veri üzerinde ön-eğitim yapılıp gerçek ARISTO-eRGB-T verisi ile ince ayar uygulanan modellerin, özellikle dış mekân sahnelerinde daha yüksek doğruluk ve daha güçlü genelleme yeteneği sergilediği gözlemlenmiştir. LLVIP ve FLIR veri kümeleri üzerinde gerçekleştirilen çapraz veri kümesi deneyleri, önerilen yaklaşımın farklı sensör yapılandırmalarına ve veri dağılımlarına başarıyla genellenebildiğini göstermiştir.

Tezin ikinci aşamasında, önerilen füzyon yaklaşımının genellenebilirliği yüz canlılık tespiti problemi üzerinden ayrıntılı biçimde değerlendirilmiştir. ARISTOF veri kümesi üzerinde gerçekleştirilen deneylerde, sadece termal görüntü içeren girdilerde sahte yüzlerin büyük ölçüde algılanamadığı; füzyonlu girdilerde ise RGB'den elde edilen yapısal bilginin yüz algılama ve canlılık ayrımı performansını anlamlı biçimde artırdığı gözlemlenmiştir. YOLOv8-Face modeli kullanılarak gerçekleştirilen iki sınıflı canlı/sahte deneylerde, yüksek hassasiyet, geri çağırım ve mAP değerleri elde edilmiş; ayrıca bağımsız test verileri üzerinde de güçlü bir genelleme performansı sergilenmiştir. Bu bulgular, önerilen füzyon temsilinin yalnızca genel nesne algılama değil, biyometrik güvenlik gibi daha hassas uygulamalarda da etkili olduğunu ortaya koymaktadır.

Sonuç olarak bu tez çalışması, RGB'den elde edilen yapısal kenar bilgisinin termal görüntülerle birleştirilmesinin hem nesne algılama hem de yüz canlılık tespiti görevlerinde pratik, etkili ve hesaplama açısından verimli bir füzyon stratejisi sunduğunu göstermektedir. Geliştirilen veri kümeleri, önerilen yöntem ve kapsamlı deneysel analizler, RGB-T çok kipli algılama alanında gelecekte yapılacak akademik ve endüstriyel çalışmalar için güçlü ve sağlam bir temel oluşturmaktadır.",True
999217,T6g0Iny3pVnujBUqvOnxfA,XMMpO9PxpEIW_OBgZupOeg,BEYZA AVAN,2026,Black-box system identification with deep recurrent networks and classical models / Derin yinelemeli ağlar ve klasik modeller ile kara-kutu sistem tanılama,Black-box system identification with deep recurrent networks and classical models,Derin yinelemeli ağlar ve klasik modeller ile kara-kutu sistem tanılama,Middle East Technical University,ORTA DOĞU TEKNİK ÜNİVERSİTESİ,İngilizce,Yüksek Lisans,Bilgisayar Mühendisliği Bilimleri-Bilgisayar ve Kontrol = Computer Engineering and Computer Science and Control ; Matematik = Mathematics,DOÇ. DR. ÖNDER TÜRK ; DR. ÖĞR. ÜYESİ NURGÜL GÖKGÖZ KÜÇÜKSAKALLI,UYGULAMALI MATEMATİK ENSTİTÜSÜ,BİLİMSEL HESAPLAMA ANABİLİM DALI,Box-Jenkins = Box-Jenkins ; Derin öğrenme = Deep learning ; Geçitli tekrarlayan birim = Gated recurrent unit ; Otoregresif modeller = Autoregressive models ; Sistem tanıma = System identification ; Uzun kısa süreli bellek = Long- short term memory,"Derin öğrenme yöntemleri çok sayıda uygulama alanında dikkate değer başarılar elde etmiş olsa da, doğrusal olmayan sistem tanımlama (nonlinear system identification) bağlamındaki kullanımları henüz etkin bir araştırma alanı olmaya devam etmektedir. Bu tez çalışmasında, doğrusal olmayan kara-kutu (black-box) sistem tanımlama problemi kapsamında, tekrarlayan sinir ağları (RNN) ile klasik sistem tanımlama yaklaşımları standart kıyas veri kümeleri üzerinde ayrıntılı ve karşılaştırmalı bir biçimde incelenmektedir. Bu doğrultuda, RNN tabanlı yaklaşımlar olan standart RNN, uzun-kısa süreli bellek (LSTM) ve kapılı tekrarlayan birim (GRU) mimarileri; klasik yöntemlerden doğrusal Box-Jenkins (BJ) modeli ile dışsal girişli doğrusal olmayan otoregresif (NARX) modelle karşılaştırılmaktadır. Modellerin başarımı, farklı hata ölçütleri ile birlikte hesaplama süresi dikkate alınarak değerlendirilmekte; böylece tahmin doğruluğu ile hesaplama verimliliği arasındaki denge nicel olarak ortaya konulmaktadır. Karşılaştırmalı analizler, doğrusal olmayan sistem tanımlama literatüründe yaygın biçimde kullanılan Silverbox kıyaslama veri seti üzerinde gerçekleştirilmektedir.

Tez çalışmasının ilk aşamasında, klasik yöntemlerde model derecelerinin sistematik olarak ayarlanması yoluyla referans sonuçlar elde edilmekte ve özellikle BJ modeli için uygulanan ızgara aramasının (grid search), standart yapılandırmalara kıyasla performansı belirgin biçimde iyileştirdiği gösterilmektedir. Ardından, sıfırdan geliştirilen bir RNN temel modeli, korelasyon temelli gecikme seçimi (lag selection) içeren, yine sıfırdan geliştirilen bir RNN varyantı ve yalnızca geçmiş giriş dizilerini kullanan PyTorch tabanlı bir RNN modeli uygulanarak uzun bellek pencerelerinin gerekliliği kapsamlı biçimde incelenmektedir. Tezin özgün katkılarından biri, uzun kaydırmalı pencere girdileri yerine, bilgilendirici gecikmeli değişkenlerden oluşan kompakt bir regresör kümesi kullanan korelasyon güdümlü, değiştirilmiş bir RNN mimarisinin önerilmesidir. Bu yapının kullanılmasıyla elde edilen sonuçlar, korelasyon temelli gecikme seçiminin hem temel RNN modeline hem de uzun ufuklu mimarilere kıyasla daha yüksek tahmin doğruluğu sağladığını; bununla birlikte model karmaşıklığını ve hesaplama yükünü belirli ölçülerde azalttığını ortaya koymaktadır.

Önerilen gecikme tasarım ilkesinin özel bir veri setinden bağımsız olarak kullanılabildiğini test etmek amacıyla, korelasyon güdümlü değiştirilmiş RNN mimarisi ayrıca Wiener–Hammerstein kıyas sistemi üzerinde test edilmiştir. Bu ek deneyler, kompakt ve bilgilendirici gecikmeli regresör kümelerinin söz konusu veri setinde de etkili biçimde çalıştığını göstermektedir. Genel olarak elde edilen bulgular, bilgilendirici gecikmeli regresörlerin RNN yapılarıyla bütünleştirilmesinin, doğrusal olmayan kara-kutu sistem tanımlama problemleri için hem yüksek doğruluk sunan hem de hesaplama açısından verimli bir yaklaşım olduğunu göstermektedir.

Yalnızca giriş verilerini kullanan tekrarlayan modellerin yanı sıra, girişlere ek olarak otoregresif çıktı geri beslemesi içeren ARX-tipi RNN formülasyonları da incelenmektedir. Silverbox kıyaslama sistemi üzerinde gerçekleştirilen deneyler, bu ARX-tipi mimarilerin analiz edilen ölçütlerde en yüksek performansı sergilediğini ortaya koymakta; bu durum, doğrusal olmayan dinamiklerin etkin biçimde modellenmesinde açık çıktı geri beslemesinin model başarımına doğrudan katkı sağladığını göstermektedir.",False
